{
  "version": 1,
  "configured": false,
  "execution_root": null,
  "task_catalog": {
    "scan_roots": [
      "~/Documents"
    ]
  },
  "learner_state_root": null,
  "learner_profile_update_policy": "ask",
  "review_backends": [],
  "supporting_review_backend": null,
  "external_memory_backend": null,
  "review_independence": "different-foundation",
  "pr_maintenance": {
    "poll_interval_seconds": 600
  }
}
